{
  "id": "integration-demos",
  "title": "Integration Demos",
  "packetType": "Demo",
  "issueTemplate": "propose-demo.yml",
  "description": "Product integration demos showcasing Devin's capabilities with third-party tools and services.",
  "maintainer": "Cognition-Partner-Workshops",
  "created": "2026-04-28",
  "updated": "2026-04-28",
  "publishState": "Published",
  "discoverability": "Partner",
  "tags": {
    "industry": [
      "Technology",
      "Cross-Industry"
    ],
    "productLine": [
      "Devin"
    ],
    "technicalDomain": [
      "Integrations"
    ],
    "language": [],
    "custom": [
      "demo",
      "integration"
    ]
  },
  "contentGroups": [],
  "resources": {
    "setupGuide": [
      {
        "title": "Linear Integration - Devin Session",
        "type": "devin-session",
        "url": "https://app.devin.ai/sessions/1f30c8c7b75c4f6f915f0eede5ac605a",
        "description": "Async Application Development: Auto kickoff at beginning of sprint anything high confidence",
        "access": "protected"
      },
      {
        "title": "Linear Integration - Talk Track",
        "type": "notion",
        "url": "https://www.notion.so/cognitionai/Linear-Demo-Script-332785ccc2b38008937ad99f1ff5aeef",
        "description": "Demo script and talk track for the Linear integration demo",
        "access": "protected"
      }
    ],
    "media": [
      {
        "title": "Linear Integration - Recording",
        "type": "video",
        "url": "https://www.loom.com/share/59ffdb72dba948df8065ec596620ecfd",
        "description": "Video recording of the Linear integration demo",
        "access": "public"
      }
    ]
  }
}
